{
  "$schema": "./compatibility.schema.json",
  "schemaVersion": 1,
  "version": "2.2.0",
  "baselineVersion": "2.2.0",
  "policy": {
    "stage": "stable",
    "additions": "allowed",
    "removals": "deprecate-before-removal"
  },
  "baseline": {
    "targetFramework": "net10.0",
    "compatibleFrameworks": [
      "net10.0",
      "net11.0"
    ],
    "behaviorNames": [
      "dialog",
      "drawer",
      "mobile-sheet",
      "dropdown",
      "stepper",
      "tag",
      "tabs",
      "accordion",
      "auto-resize",
      "combobox",
      "password-toggle",
      "clear-input",
      "otp-input",
      "password-strength",
      "auth-timer",
      "quantity-stepper",
      "sku-selector",
      "cart",
      "coupon",
      "pull-refresh",
      "infinite-load",
      "swipe-actions",
      "wheel-picker",
      "ai-composer",
      "prompt-fill",
      "ai-approval",
      "ai-feedback",
      "shortcut-recorder",
      "desktop-tabs",
      "native-file-picker",
      "window-switcher",
      "character-count",
      "field-sync",
      "conditional-field",
      "rating",
      "validation-summary",
      "repeatable-field",
      "tooltip",
      "popover",
      "tour",
      "carousel",
      "split-pane",
      "foundation",
      "tree",
      "data-grid",
      "data-display",
      "dashboard",
      "interaction",
      "content",
      "layout",
      "help",
      "ai",
      "media",
      "auth",
      "mobile",
      "workflow",
      "communication",
      "legal",
      "solution",
      "desktop",
      "enterprise",
      "marketing",
      "cms",
      "commerce",
      "table-scroll",
      "table-density",
      "filter-summary",
      "table-sort",
      "row-select",
      "row-disclosure",
      "column-toggle",
      "data-filter",
      "data-view",
      "transfer",
      "picker",
      "cascader",
      "range-picker",
      "saved-choice",
      "builder-list",
      "toast",
      "copy",
      "fullscreen",
      "scroll-top",
      "dropzone",
      "nav-toggle",
      "roving-nav",
      "context-menu",
      "scrollspy",
      "jump-nav",
      "upload-manager",
      "file-browser",
      "media-player",
      "editor-shell",
      "revision-compare",
      "autosave",
      "command-palette"
    ],
    "behaviorContracts": [
      {
        "name": "dialog",
        "attribute": "data-g-dialog",
        "instanceMembers": [
          "open",
          "close",
          "toggle",
          "isOpen",
          "setBusy",
          "complete",
          "destroy"
        ]
      },
      {
        "name": "drawer",
        "attribute": "data-g-drawer",
        "instanceMembers": [
          "open",
          "close",
          "toggle",
          "isOpen",
          "setBusy",
          "complete",
          "destroy"
        ]
      },
      {
        "name": "mobile-sheet",
        "attribute": "data-g-mobile-sheet",
        "instanceMembers": [
          "open",
          "close",
          "toggle",
          "isOpen",
          "setBusy",
          "complete",
          "destroy"
        ]
      },
      {
        "name": "dropdown",
        "attribute": "data-g-dropdown",
        "instanceMembers": [
          "open",
          "close",
          "toggle",
          "isOpen",
          "destroy"
        ]
      },
      {
        "name": "stepper",
        "attribute": "data-g-stepper",
        "instanceMembers": [
          "current",
          "select",
          "next",
          "previous",
          "refresh",
          "destroy"
        ]
      },
      {
        "name": "tag",
        "attribute": "data-g-tag",
        "instanceMembers": [
          "check",
          "close",
          "setOptions",
          "getState",
          "refresh",
          "destroy"
        ]
      },
      {
        "name": "tabs",
        "attribute": "data-g-tabs",
        "instanceMembers": [
          "select",
          "destroy"
        ]
      },
      {
        "name": "accordion",
        "attribute": "data-g-accordion",
        "instanceMembers": [
          "toggle",
          "open",
          "close",
          "value",
          "refresh",
          "destroy"
        ]
      },
      {
        "name": "auto-resize",
        "attribute": "data-g-auto-resize",
        "instanceMembers": [
          "resize",
          "destroy"
        ]
      },
      {
        "name": "combobox",
        "attribute": "data-g-combobox",
        "instanceMembers": [
          "open",
          "close",
          "choose",
          "clear",
          "search",
          "destroy"
        ]
      },
      {
        "name": "password-toggle",
        "attribute": "data-g-password-toggle",
        "instanceMembers": [
          "toggle",
          "destroy"
        ]
      },
      {
        "name": "clear-input",
        "attribute": "data-g-clear-input",
        "instanceMembers": [
          "clear",
          "update",
          "destroy"
        ]
      },
      {
        "name": "otp-input",
        "attribute": "data-g-otp-input",
        "instanceMembers": [
          "value",
          "fill",
          "clear",
          "destroy"
        ]
      },
      {
        "name": "password-strength",
        "attribute": "data-g-password-strength",
        "instanceMembers": [
          "update",
          "destroy"
        ]
      },
      {
        "name": "auth-timer",
        "attribute": "data-g-auth-timer",
        "instanceMembers": [
          "start",
          "reset",
          "expire",
          "remaining",
          "destroy"
        ]
      },
      {
        "name": "quantity-stepper",
        "attribute": "data-g-quantity-stepper",
        "instanceMembers": [
          "value",
          "set",
          "increment",
          "decrement",
          "destroy"
        ]
      },
      {
        "name": "sku-selector",
        "attribute": "data-g-sku-selector",
        "instanceMembers": [
          "value",
          "select",
          "destroy"
        ]
      },
      {
        "name": "cart",
        "attribute": "data-g-cart",
        "instanceMembers": [
          "update",
          "summary",
          "destroy"
        ]
      },
      {
        "name": "coupon",
        "attribute": "data-g-coupon",
        "instanceMembers": [
          "apply",
          "clear",
          "state",
          "destroy"
        ]
      },
      {
        "name": "pull-refresh",
        "attribute": "data-g-pull-refresh",
        "instanceMembers": [
          "refresh",
          "complete",
          "isRefreshing",
          "destroy"
        ]
      },
      {
        "name": "infinite-load",
        "attribute": "data-g-infinite-load",
        "instanceMembers": [
          "load",
          "complete",
          "isLoading",
          "destroy"
        ]
      },
      {
        "name": "swipe-actions",
        "attribute": "data-g-swipe-actions",
        "instanceMembers": [
          "reveal",
          "close",
          "toggle",
          "destroy"
        ]
      },
      {
        "name": "wheel-picker",
        "attribute": "data-g-wheel-picker",
        "instanceMembers": [
          "select",
          "values",
          "destroy"
        ]
      },
      {
        "name": "ai-composer",
        "attribute": "data-g-ai-composer",
        "instanceMembers": [
          "submit",
          "stop",
          "setStreaming",
          "value",
          "focus",
          "destroy"
        ]
      },
      {
        "name": "prompt-fill",
        "attribute": "data-g-prompt-fill",
        "instanceMembers": [
          "fill",
          "destroy"
        ]
      },
      {
        "name": "ai-approval",
        "attribute": "data-g-ai-approval",
        "instanceMembers": [
          "choose",
          "reset",
          "destroy"
        ]
      },
      {
        "name": "ai-feedback",
        "attribute": "data-g-ai-feedback",
        "instanceMembers": [
          "select",
          "submit",
          "value",
          "destroy"
        ]
      },
      {
        "name": "shortcut-recorder",
        "attribute": "data-g-shortcut-recorder",
        "instanceMembers": [
          "start",
          "stop",
          "clear",
          "value",
          "destroy"
        ]
      },
      {
        "name": "desktop-tabs",
        "attribute": "data-g-desktop-tabs",
        "instanceMembers": [
          "select",
          "close",
          "tabs",
          "destroy"
        ]
      },
      {
        "name": "native-file-picker",
        "attribute": "data-g-native-file-picker",
        "instanceMembers": [
          "open",
          "files",
          "clear",
          "destroy"
        ]
      },
      {
        "name": "window-switcher",
        "attribute": "data-g-window-switcher",
        "instanceMembers": [
          "open",
          "close",
          "select",
          "isOpen",
          "destroy"
        ]
      },
      {
        "name": "character-count",
        "attribute": "data-g-character-count",
        "instanceMembers": [
          "update",
          "destroy"
        ]
      },
      {
        "name": "field-sync",
        "attribute": "data-g-field-sync",
        "instanceMembers": [
          "sync",
          "value",
          "destroy"
        ]
      },
      {
        "name": "conditional-field",
        "attribute": "data-g-conditional-field",
        "instanceMembers": [
          "update",
          "value",
          "values",
          "controllers",
          "isVisible",
          "isResolved",
          "destroy"
        ]
      },
      {
        "name": "rating",
        "attribute": "data-g-rating",
        "instanceMembers": [
          "value",
          "setValue",
          "clear",
          "refresh",
          "destroy"
        ]
      },
      {
        "name": "validation-summary",
        "attribute": "data-g-validation-summary",
        "instanceMembers": [
          "errors",